{
  "schema": "urn:algaguard:schema:onboarding:credential-revocation-status:v1",
  "schemaVersion": "1.0.0",
  "credentialId": "11111111-1111-4111-8111-111111111111",
  "deviceUuid": "aaaaaaaa-aaaa-4aaa-8aaa-aaaaaaaaaaaa",
  "deviceId": "AG-000001",
  "status": "REVOKED",
  "revokedAt": "2026-07-24T01:01:02Z",
  "revocationReason": "ROTATED",
  "effectiveWithinSeconds": 5,
  "updatedAt": "2026-07-24T01:01:02Z"
}
